{
  "context": "Runtime Application Self-Protection (RASP) system for detecting and remediating CWE, CVE, and SANS Top 25 vulnerabilities at runtime in web applications. Internal application with business criticality level 3, targeting India and Singapore markets with data privacy and governance constraints.",
  "userStories": [
    {
      "id": "US-1",
      "title": "Real-time Vulnerability Detection",
      "asA": "Security Administrator",
      "iWantTo": "automatically detect CWE, CVE, and SANS Top 25 vulnerabilities in real-time during application execution",
      "soThat": "I can identify and prevent security threats before they impact the system",
      "storyPoints": 8,
      "priority": "Critical",
      "tags": ["Security", "Backend", "Real-time", "Vulnerability"],
      "relatedUserStories": ["US-2", "US-3"],
      "epic": "Core Security Detection",
      "acceptanceCriteria": [
        {
          "id": "AC-1",
          "given": "the RASP agent is monitoring a web application",
          "when": "a CWE, CVE, or SANS Top 25 vulnerability is attempted",
          "then": "the system detects and logs the vulnerability within 100ms"
        },
        {
          "id": "AC-2",
          "given": "multiple vulnerabilities occur simultaneously",
          "when": "the detection engine processes requests",
          "then": "all vulnerabilities are identified and prioritized by severity"
        },
        {
          "id": "AC-3",
          "given": "a new CVE is published",
          "when": "the vulnerability database is updated",
          "then": "the detection engine incorporates the new signature within 24 hours"
        }
      ]
    },
    {
      "id": "US-2",
      "title": "Automated Threat Remediation",
      "asA": "Security Administrator",
      "iWantTo": "automatically remediate detected vulnerabilities without manual intervention",
      "soThat": "I can prevent security breaches and maintain system integrity",
      "storyPoints": 13,
      "priority": "Critical",
      "tags": ["Security", "Backend", "Automation", "Remediation"],
      "relatedUserStories": ["US-1", "US-4"],
      "epic": "Core Security Detection",
      "acceptanceCriteria": [
        {
          "id": "AC-4",
          "given": "a critical vulnerability is detected",
          "when": "the remediation engine evaluates the threat",
          "then": "appropriate countermeasures are applied within 500ms"
        },
        {
          "id": "AC-5",
          "given": "remediation actions are taken",
          "when": "the system applies security measures",
          "then": "application functionality is preserved without breaking legitimate requests"
        },
        {
          "id": "AC-6",
          "given": "remediation fails for any reason",
          "when": "the system cannot apply countermeasures",
          "then": "the request is blocked and an alert is generated"
        }
      ]
    },
    {
      "id": "US-3",
      "title": "Security Dashboard and Monitoring",
      "asA": "Security Operator",
      "iWantTo": "view real-time security metrics and vulnerability trends through a dashboard",
      "soThat": "I can monitor system security posture and make informed decisions",
      "storyPoints": 5,
      "priority": "High",
      "tags": ["Frontend", "Dashboard", "Monitoring", "Analytics"],
      "relatedUserStories": ["US-1", "US-5"],
      "epic": "Security Operations",
      "acceptanceCriteria": [
        {
          "id": "AC-7",
          "given": "security events are occurring",
          "when": "I access the security dashboard",
          "then": "I see real-time vulnerability counts, severity distribution, and trend charts"
        },
        {
          "id": "AC-8",
          "given": "I need to investigate a security incident",
          "when": "I click on a vulnerability event",
          "then": "detailed information including payload, source IP, and remediation action is displayed"
        },
        {
          "id": "AC-9",
          "given": "the dashboard is displaying data",
          "when": "new security events occur",
          "then": "the dashboard updates automatically within 5 seconds"
        }
      ]
    },
    {
      "id": "US-4",
      "title": "Compliance Reporting",
      "asA": "Compliance Officer",
      "iWantTo": "generate compliance reports for India and Singapore regulatory requirements",
      "soThat": "I can demonstrate adherence to data protection and privacy regulations",
      "storyPoints": 8,
      "priority": "High",
      "tags": ["Compliance", "Reporting", "Privacy", "Governance"],
      "relatedUserStories": ["US-2", "US-6"],
      "epic": "Compliance and Governance",
      "acceptanceCriteria": [
        {
          "id": "AC-10",
          "given": "security events have occurred over a period",
          "when": "I request a compliance report",
          "then": "a report is generated containing incident summaries, response times, and remediation actions"
        },
        {
          "id": "AC-11",
          "given": "personal data processing events are detected",
          "when": "the system logs security activities",
          "then": "data privacy requirements are respected and sensitive information is masked"
        },
        {
          "id": "AC-12",
          "given": "regulatory audit requirements",
          "when": "compliance reports are generated",
          "then": "reports include all required fields for India and Singapore regulations"
        }
      ]
    },
    {
      "id": "US-5",
      "title": "Alert and Notification System",
      "asA": "Security Administrator",
      "iWantTo": "receive immediate notifications for critical security events",
      "soThat": "I can respond quickly to potential security breaches",
      "storyPoints": 3,
      "priority": "High",
      "tags": ["Notifications", "Alerts", "Integration", "Communication"],
      "relatedUserStories": ["US-3"],
      "epic": "Security Operations",
      "acceptanceCriteria": [
        {
          "id": "AC-13",
          "given": "a critical vulnerability is detected",
          "when": "the threat level exceeds the defined threshold",
          "then": "immediate notifications are sent via email, SMS, and dashboard alert"
        },
        {
          "id": "AC-14",
          "given": "multiple alerts are triggered",
          "when": "the notification system processes events",
          "then": "alerts are de-duplicated and prioritized to prevent spam"
        },
        {
          "id": "AC-15",
          "given": "notification channels are configured",
          "when": "security events occur",
          "then": "alerts are delivered within 30 seconds using the configured channels"
        }
      ]
    },
    {
      "id": "US-6",
      "title": "Configuration Management",
      "asA": "System Administrator",
      "iWantTo": "configure RASP policies, thresholds, and remediation rules",
      "soThat": "I can customize the system behavior to match organizational security requirements",
      "storyPoints": 5,
      "priority": "Medium",
      "tags": ["Configuration", "Backend", "Policy", "Management"],
      "relatedUserStories": ["US-4"],
      "epic": "System Management",
      "acceptanceCriteria": [
        {
          "id": "AC-16",
          "given": "I need to modify security policies",
          "when": "I access the configuration interface",
          "then": "I can update detection rules, remediation actions, and alert thresholds"
        },
        {
          "id": "AC-17",
          "given": "configuration changes are made",
          "when": "policies are updated",
          "then": "changes take effect within 60 seconds without system restart"
        },
        {
          "id": "AC-18",
          "given": "invalid configuration is provided",
          "when": "I attempt to save policy changes",
          "then": "the system validates the configuration and provides clear error messages"
        }
      ]
    }
  ],
  "errorAndEdgeCases": [
    "Network connectivity loss between RASP agent and central management system",
    "High volume attack scenarios overwhelming the detection engine",
    "False positive detection leading to blocking legitimate user requests",
    "Database corruption affecting vulnerability signature updates",
    "Memory exhaustion during heavy attack scenarios",
    "Configuration conflicts between multiple policy rules",
    "Timezone handling for compliance reporting across India and Singapore",
    "SSL/TLS certificate expiration affecting secure communications",
    "Concurrent access conflicts during policy updates",
    "Data retention limits causing loss of historical security data"
  ],
  "assumptions": [
    "Web applications will integrate the RASP agent through standard APIs",
    "Network infrastructure supports real-time communication between agents and management system",
    "Vulnerability databases (NIST, MITRE) are accessible for regular updates",
    "System administrators have appropriate permissions to configure security policies",
    "Compliance requirements for India and Singapore remain stable during implementation",
    "Application performance impact from RASP monitoring is acceptable (<5% overhead)",
    "Development teams will follow secure coding practices alongside RASP deployment",
    "Infrastructure supports horizontal scaling for high-volume environments"
  ],
  "openQuestions": [
    "What is the acceptable performance overhead threshold for production systems?",
    "Which specific India and Singapore compliance frameworks must be supported?",
    "How should the system handle applications with existing security tools?",
    "What is the required data retention period for security events and logs?",
    "Should the system support on-premises, cloud, or hybrid deployment models?",
    "What integration capabilities are needed with existing SIEM and SOC tools?",